{
  "id": "44444444-4444-4444-8444-444444444444",
  "type": "monitor.created",
  "version": 1,
  "occurredAt": "2026-09-01T00:00:00Z",
  "organizationId": "22222222-2222-4222-8222-222222222222",
  "correlationId": "11111111-1111-4111-8111-111111111111",
  "payload": {
    "monitorId": "33333333-3333-4333-8333-333333333333"
  }
}
